url;Publication;Authors;Institution;Affiliation;Country;Journal;Citations;Date;Year;Application;Materials;Number of classes;Classes;Exploratory data analysis;Preprocessing;Feature selection;Feature selection approach;Spectral input;Classification approaches;Classification;Classifier;Best model;Validation internal;Validation external;Model validation;Software
https://link.springer.com/article/10.1007/s00339-006-3556-6;LIPS and linear correlation analysis applied to the classification of Roman pottery Terra Sigillata;López et al., 2006;Universidade da Coruña;Dpto. Enxeñaría Industrial II, Universidade da Coruña,  Spain;Spain;Applied Physics A;25;09.03.2006;2006;Materials;Ceramics;3;Hispanic, Gaulic, African;Visual inspection;-;-;-;LIBS spectrum:  RawInt (260-340 nm);Correlation;Correlation;Linear correlation;Linear correlation ;-;-;Internal;MATLAB
https://link.springer.com/article/10.1007/s00216-006-0513-3;LIBS for landmine detection and discrimination;Harmon et al., 2006;U.S. Army Research Laboratory;U.S. Army Research Laboratory, United States;United States;Analytical and Bioanalytical Chemistry;56;25.05.2006;2006;Forensics/Explosives;Explosives;2;mine, non-mine;Visual inspection;-;-;-;LIBS spectrum:  RawInt (200-980 nm);Correlation;Correlation;Linear correlation;Linear correlation ;accuracy: 90%;-;Internal;Ocean Optics
https://pubs.rsc.org/en/content/articlelanding/2007/ja/b704868h/unauth;Feasibility study of rock identification at the surface of Mars by remote laser-induced breakdown spectroscopy and three chemometric methods;Sirven et al., 2007;CEA Saclay;CEA Saclay, France;France;Journal of Analytical Atomic Spectrometry;132;20.08.2007;2007;Geological samples;Rocks;6;basalt (ES9206), limestone (RJ3), gabbro (OT9101), trachy-andesite (ES9106), trachyte (ES9101), obsidian (LMG Little Mountain Glass);PCA;NormIS (O: 777.2);-;-;LIBS spectrum:  8421 RawInt (280-1000 nm);SIMCA, PLS-DA;SIMCA;SIMCA+PLS/DA;SIMCA+PLS/DA;sensitivity, robustness: 97%;-;Internal + External;MATLAB
https://www.sciencedirect.com/science/article/abs/pii/S0584854707003527;Double pulse laser-induced breakdown spectroscopy of explosives: Initial study towards improved discrimination;De Lucia et al., 2007;U.S. Army Research Laboratory;U.S. Army Research Laboratory, United States;United States;Spectrochimica Acta Part B: Atomic Spectroscopy;96;22.10.2007;2007;Forensics/Explosives;Explosives;2;explosive (RDX, Comp-B), non-explosive (diesel fuel);Visual inspection;NormArea (C + C2 + CN+ H + N+ O + Ca + Na + K);domain knowledge;Domain k-wledge;Features:  5 IntRatios (O/C, O/H, N/C, N/H, O/N);Ratios, PCA, PLS-DA;PCA;PCA;PCA (PC1 score);-;-;?;?
https://link.springer.com/content/pdf/10.1007/s00339-008-4481-7.pdf;Application of artificial neural networks for the rapid classification of archaeological ceramics by means of laser induced breakdown spectroscopy (LIBS);Ramil et al., 2008;Universidade da Coruña;Dpto. Enxeñaría Industrial II, Universidade da Coruña, Spain;Spain;Applied Physics A;84;01.04.2008;2008;Materials;Ceramics;3;Hispanic, Gaulic, African;Visual inspection;NormArea;-;-;LIBS spectrum:  512 RawInt (260-340 nm);ANN;ANN;ANN;MLP (512,25,3);accuracy: 100%;-;Internal;MATLAB
https://pubmed.ncbi.nlm.nih.gov/19122692/;Multivariate analysis of standoff laser-induced breakdown spectroscopy spectra for classification of explosive-containing residues;De Lucia et al., 2008;U.S. Army Research Laboratory;U.S. Army Research Laboratory, United States;United States;Applied Optics;112;18.08.2008;2008;Forensics/Explosives;Explosives;2;explosive (RDX, Comp-B, TNT), non-explosive;PCA;BckgCorr, Norm;domain knowledge;Domain k-wledge;Features:  20 PeakRatios, 9 PeakAreas (190-840 nm);PLS-DA;PLS-DA;PLS-DA;PLS-DA;accuracy: 80%;-;Internal;MATLAB
https://www.sciencedirect.com/science/article/abs/pii/S0003267009003493;Classification of Brazilian soils by using LIBS and variable selection in the wavelet domain;Pontes et al., 2009;Universidade Federal da Paraíba;Universidade Federal da Paraíba, Brasil;Brasil;Analytica Chimica Acta;110;29.05.2009;2009;Soil;Soil;3;Argissolo, Latossolo, Nitossolo;PCA;NormSNV, WT;GA/SW/SPA;Wrapper-based;Features:  5 (200-990 nm);LDA;LDA;LDA; WT-SPA–LDA;accuracy: 90%;-;Internal;MATLAB
https://www.sciencedirect.com/science/article/abs/pii/S0883292709000596;LIBS analysis of geomaterials: Geochemical fingerprinting for the rapid analysis and discrimination of minerals;Harmon et al., 2009;U.S. Army Research Laboratory;U.S. Army Research Laboratory, United States;United States;Applied Geochemistry;143;01.06.2009;2009;Geological samples;Minerals;7;metals, mixed mineral set, pyroxenes, feldspars, carbonates, beryls, combined mineral group;Visual inspection;-;WghtVar;Weighting;LIBS spectrum:  13500 RawIntWght (200-965 nm);Correlation;Correlation;Maximum correlation;MV-MC;accuracy: 85%;-;Internal;Ocean Optics
https://www.sciencedirect.com/science/article/abs/pii/S0584854709002237;Preliminary evaluation of laser-induced breakdown spectroscopy for tissue classification;Yueh et al., 2009;Mississippi State University;Institute for Clean Energy Technology, Mississippi State University, United States;United States;Spectrochimica Acta Part B: Atomic Spectroscopy;81;01.10.2009;2009;Biological/Life Science;Tissue;6;muscle, kidney, liver, lung, spleen, brain;PCA;NormIS (Ca: 422.6 nm);domain knowledge;Domain k-wledge;Features:  21 PeakAreas (200-780 nm);PLS-DA, ANN;PLS-DA;PLS-DA;PLS-DA ;-;accuracy: 60%;External;MATLAB
https://www.sciencedirect.com/science/article/abs/pii/S0584854709001967;Multivariate analysis of laser-induced breakdown spectroscopy chemical signatures for geomaterial classification;Gottfried et al., 2010;U.S. Army Research Laboratory;U.S. Army Research Laboratory, United States;United States;Spectrochimica Acta Part B: Atomic Spectroscopy;148;06.07.2009;2009;Geological samples;Geomaterials;-;-;?;-;-;?;-;PLS-DA;PLS-DA;PLS-DA;PLS-DA;-;-;?;?
https://journals.sagepub.com/doi/pdf/10.1366/10-06079a;Identification of Polymer Materials Using Laser-Induced Breakdown Spectroscopy Combined with Artificial Neural Networks;Boueri et al., 2010;Université de Lyon;Université de Lyon, France;France;Applied Spectroscopy;96;30.11.2010;2010;Polymers;Polymers;8;polypropylene (PP), polyvinyl chloride (PVC), polytetrafluoroethylene (PTFE), polyoxymethylene (POM), polyethylene (PE), polyamide/nylon (PA), polycarbonate (PC), poly(methyl methacrylate) (PMMA);Visual inspection;NormIS (C: 247.9 nm);domain knowledge, wrapper (ANN);Wrapper-based;Features:  13 PeakInt (C, Mg, Ti, CN, Ca, Na, H, F, Cl, N, K, O);ANN;ANN;ANN;MLP (13,25,8);-;accuracy: 81%;External;?
https://www.sciencedirect.com/science/article/abs/pii/S0142941810001224;Identification of polymers by libs using methods of correlation and normalized coordinates;Lasheras et al., 2010;University of Zaragoza;Laser Laboratory and Environment, Department of Analytical Chemistry, University of Zaragoza, Spain;Spain;Polymer Testing;44;01.12.2010;2010;Polymers;Polymers;9;polyethylene (PE), polypropylene (PP), polystyrene (PS), polyethylene terephthalate (PET), poly-vinyl chloride (PVC), polytetrafluoroethene (PTFE), nylon, cellulose, rubber;Visual inspection;-;-;-;LIBS spectrum:  2048 RawInt (200-850 nm);Correlation (linear, rank, MVC);Correlation;Linear correlation;Linear correlation ;accuracy: 100%;-;Internal;Visual Basic
https://link.springer.com/article/10.1007/s00216-011-4869-7;Characterization and forensic analysis of soil samples using laser-induced breakdown spectroscopy (LIBS);Jantzi et al., 2011;Florida International University;Department of Chemistry and Biochemistry and International Forensic Research Institute, Florida International University, United States;United States;Analytical and Bioanalytical Chemistry;74;02.04.2011;2011;Soil;Soil;5;SE of Florida City,  Sweetwater, Canal C6, Krome North Tower, Homestead Airport ;PCA;BckgCorr,  NormIS (Sc: 361.4 nm);filter (discriminative power);Filter-based ;Features:  5 IntRatios (Sr/Ti, Ba/Mg, Ca/Mg, Fe/Mg, Li/Mg);ANOVA, LDA, PCA;LDA;LDA;LDA;accuracy: 99%;-;Internal;Systat
https://link.springer.com/article/10.1007/s00216-011-4898-2;Laser-induced breakdown spectroscopy for polymer identification;Grégoire et al., 2011;Mnistry of Culture France;Laboratoire de Recherche des Monuments Historiques, Mnistry of Culture, France;France;Analytical and Bioanalytical Chemistry;89;05.04.2011;2011;Polymers;Polymers;14;polyethylene (PE), polypropylene (PP), polyoxymethylene, (POM), polyvinyl chloride (PVC), polytetrafluoroethylene (PTF), polyoxyethylene (POE), polyamide (PA), poly(butylene terephthalate) (PBT), acrylonitrile–butadiene–styrene (PBS), polystyrene (PS), polycarbonate (PC);Visual inspection + PCA;-;domain knowledge;Domain k-wledge;Features:  6 PeakInt (200-975 nm);Ratios, PCA, PLS-DA;PLS-DA;PLS-DA;PLS-DA ;-;-;Internal;Unscrambler
https://www.sciencedirect.com/science/article/abs/pii/S0584854711001662;Detection of explosives in traces by laser induced breakdown spectroscopy: Differences from organic interferents and conditions for a correct classification;Lazic et al., 2011;ENEA;National Agency for New Technologies, Energy and Sustainable Economic Development, Italy;Italy;Spectrochimica Acta Part B: Atomic Spectroscopy;35;08.08.2011;2011;Forensics/Explosives;Explosives;10;EGDN, NG, RDX, TNT, DNT, PETN, HMX, TETRYL, TATP, Diesel oil, Paraffin waf, Hand cream;?;-;-;?;-;-;?;?;-;-;-;?;?
https://link.springer.com/article/10.1007/s00216-011-5287-6;Multivariate classification of pigments and inks using combined Raman spectroscopy and LIBS;Hoehse et al., 2011;BAM;BAM Federal Institute for Materials Research and Testing, Germany;Germany;Analytical and Bioanalytical Chemistry;111;16.08.2011;2011;Forensics/Explosives;Pigments and Inks;10;10 inks povided by state criminal investigation department;Visual inspection + PCA;BckgCorr,  NormSNV;-;-;LIBS-Raman: RawInt (290-930 nm, 1797-2432 cm-1);PCA, SIMCA, PLS-DA, SVM;SIMCA;SIMCA+PLS/DA;SIMCA+PLS/DA;-;-;Internal;Unscrambler
https://opg.optica.org/viewmedia.cfm?r=1&rwjcode=ao&uri=ao-51-7-B83&html=true;Classification of explosive residues on organic substrates using laser induced breakdown spectroscopy;De Lucia et al., 2011;U.S. Army Research Laboratory;U.S. Army Research Laboratory, United States;United States;Applied Optics;43;11.11.2011;2011;Forensics/Explosives;Explosives;2;explosive (RDX, TNT, Comp-B), non-explosive (substrate, lubricant oil, dust, fingerprint oil, sand, diesel fuel);Visual inspection;Norm;domain knowledge;Domain k-wledge;Features:  132 PeakRatios, PeakAreas (C, C2, CN, H, O, N);PLS-DA;PLS-DA;PLS-DA;PLS-DA;-;TPR: 98%;External;MATLAB
https://www.sciencedirect.com/science/article/abs/pii/S0039914011008459;Laser-induced breakdown spectroscopy-based investigation and classification of pharmaceutical tablets using multivariate chemometric analysis;Myakalwar et al., 2011;ACRHEM;ACRHEM, University of Hyderabad, India;India;Talanta;111;15.12.2011;2011;Biological/Life Science;Pharmaceutical Samples;6;brufen, brufen-coated, glucosamine, glucosamine-coated, vitamin C, paracetamol;Visual inspection + PCA;-;-;-;LIBS spectrum:  25505 RawInt (200-1000 nm);PCA, SIMCA;SIMCA;SIMCA;SIMCA ;accuracy: 90%;-;Internal;MATLAB
https://pubs.acs.org/doi/10.1021/ac202755e;Incorporation of Support Vector Machines in the LIBS Toolbox for Sensitive and Robust Classification Amidst Unexpected Sample and System Variability;Dingari et al., 2012;MIT;Laser Biomedical Research Center, MIT, United States;United States;Analytical Chemistry;97;31.01.2012;2012;Biological/Life Science;Pharmaceutical Samples;6;brufen, brufen-coated, glucosamine, glucosamine-coated, vitamin C, paracetamol;Visual inspection + PCA;-;-;-;LIBS spectrum:  25505 RawInt (200-1000 nm);SVM, SIMCA, PLS-DA;SVM;SVM;SVM (RBF kernel);accuracy: 96%;-;Internal;MATLAB
https://journals.sagepub.com/doi/full/10.1366/11-06379;Feasibility of Laser-Induced Breakdown Spectroscopy (LIBS) for Classification of Sea Salts;Tan et al., 2012;Mokpo National University;Department of Chemistry, Mokpo National University, Korea;Korea;Applied Spectroscopy;33;01.03.2012;2012;Foodstuff;Salts;11;Korea (5), China (2), Japan (2), France (2);Visual inspection + PCA;NormIS (CN band);PCA;PCA;Features:  5 PCs (760-800 nm);PLS-DA;PLS-DA;PLS-DA;PLS-DA;accuracy: 85%;-;Internal;?
https://www.sciencedirect.com/science/article/abs/pii/S0142941812000748;Discrimination of polymers by laser induced breakdown spectroscopy together with the DFA method;Banaee et al., 2012;Laser and Plasma Research Institute, Beheshti University,;Laser and Plasma Research Institute, Shahid Beheshti University, Iran;Iran;Polymer Testing;48;01.09.2012;2012;Polymers;Polymers;6;"polyethylene terephthalate (PET), high density polyethylene (HDPE), polyvinyl chloride
(PVC), low density polyethylene (LDPE), polypropylene (PP), polystyrene (PS)";Visual inspection;BckgCorr;domain knowledge, wrapper (DFA);Wrapper-based;Features:  10 IntRatios (Cl/C, C2/C, H/C, O/C, CN/C, N/C, CN/C, N/C, N/O, C2/C);DFA;DFA;DFA;DFA ;accuracy: 99%;-;Internal;SPSS
https://pubs.rsc.org/en/content/articlelanding/2013/ra/c3ra44946g#!divAbstract;Analytical predictive capabilities of Laser Induced Breakdown Spectroscopy (LIBS) with Principal Component Analysis (PCA) for plastic classification;Unnikrishnan et al., 2013;Manipal University;Centre for Atomic and Molecular Physics, Manipal University, India;India;RSC Advances;94;18.10.2013;2013;Polymers;Polymers;4;polyethylene terephthalate (PET), high density polyethylene (PE), polypropylene (PP), polystyrene (PS);Visual inspection + PCA;SmoothFourier;domain knowledge;Domain k-wledge;LIBS subregions:  RawInt (245-260 nm, 375-390 nm, 485-50 nm);PCA, M-distance;PCA;PCA, M-distance;PCA, M-distance;?;?;Internal;GRAMS
https://opg.optica.org/ao/abstract.cfm?uri=ao-53-4-544;Classification of steel materials by laser-induced breakdown spectroscopy coupled with support vector machines;Liang et al., 2014;Northwest University;College of Chemistry and Materials Science, Northwest University, China;China;Applied Optics;51;23.01.2014;2014;Materials;Steel;9;20 , 20Cr, 20CrMnTi, 20CrMo, 20CrNiMo, 35, 35CrMo, 40Cr, 42CrMo, 20CrMnTi, 20CrMo, 20CrNiMo, 35, 35CrMo, 40Cr, 42CrMo;Visual inspection;-;-;-;LIBS spectrum:  RawInt (220-800 nm);SVM;SVM;SVM;SVM (polynomial kernel);accuracy: 92%;-;Internal;MATLAB
https://opg.optica.org/oe/fulltext.cfm?uri=oe-22-4-3895&id=279414;Accuracy improvement on polymer identification using laser-induced breakdown spectroscopy with adjusting spectral weightings;Guo et al., 2014;Huazhong University of Science and Technology;Wuhan National Laboratory for Optoelectronics (WNLO), Huazhong University of Science and Technology, China;China;Optics Express;51;12.02.2014;2014;Polymers;Polymers;9;polytetrafluoroethylene (PTFE), polyurethane (PU), polysytrene (PS), polycarbonate (PC), polyvinyl chloride (PVC), acrylonitrile-butadiene-styrene (ABS), plexiglass (PMMA), polyamide (PA), polypropylene (PP), polyethylene (PE), polyoxymethylene (POM);?;NormIS (C: 247.9 nm);WghtPCA;Weighting;LIBS spectrum:  RawIntWght (200-950 nm);SVM;SVM;SVM;SVM (RBF);accuracy: 100%;-;Internal;MATLAB
https://www.sciencedirect.com/science/article/abs/pii/S0039914013009703;Reliable classification of moving waste materials with LIBS in concrete recycling;Xia et al., 2014;Delft University of Technology;Faculty of Civil Engineering and Geosciences, Delft University of Technology,  Netherlands;Netherlands;Talanta;37;01.03.2014;2014;Materials;Concrete;8;cement, brick, gypsum block, wood, PVC plastic, glass, aggregate, steel rebar;Visual inspection;NormArea;-;-;LIBS spectrum:  3648 RawInt (250-800 nm);PCA-Adaboost, PLS-DA;PLS-DA;PLS-DA;PLS-DA (15 LVs);accuracy: 99%;-;Internal;MATLAB
https://www.sciencedirect.com/science/article/abs/pii/S0308814613014106;Classification of vegetable oils based on their concentration of saturated fatty acids using laser induced breakdown spectroscopy (LIBS);Kongbonga et al., 2013;University of Tunis;Laboratory of Spectroscopy of Atomic Molecular and Applications – LSAMA, Faculty of Sciences of Tunis, University of Tunis, Tunisia;Tunisia;Food Chemistry;54;29.09.2013;2013;Foodstuff;Vegetable Oils;3;palm oil (50% saturated FA), olive oil (14% saturated FA), sunflower oil (13% saturated FA);Visual inspection;-;domain knowledge;Domain k-wledge;Features:  1 IntRatio (C/C2);ANOVA;ANOVA;ANOVA;ANOVA;-;-;?;LIFBASE
https://www.sciencedirect.com/science/article/abs/pii/S0379073814001960;Assessment and forensic application of laser-induced breakdown spectroscopy (LIBS) for the discrimination of Australian window glass;El-Deftar et al., 2014;University of Canberra;National Centre for Forensic Studies, University of Canberra, Australia;Australia;Forensic Science International;30;29.04.2014;2014;Forensics/Explosives;Window glass;2;20 crime scenes;Visual inspection;-;-;?;Features:  11 IntRatio (Al/Ca, Al/Ti, Fe/Al, Ba/Sr, Ti/Sr, Al/Sr, Si/Al, Na/Ti, Na/K, Ba/Ca, Sr/Zr);ANOVA;ANOVA;ANOVA;ANOVA;discriminative power: 97%;-;?;?
https://www.sciencedirect.com/science/article/abs/pii/S0584854714002122;Comparative study on fast classification of brick samples by combination of principal component analysis and linear discriminant analysis using stand-off and table-top laser-induced breakdown spectroscopy;Vítková et al., 2014;CEITEC;Central European Institute of Technology, Brno University of Technology, Czech Republic;Czech Republic;Spectrochimica Acta Part B: Atomic Spectroscopy;46;01.11.2014;2014;Materials;Bricks;7;"Šlapanice, Hranice na Moravě, Tallinn, Skalka u Velimi, Těšetice,
Strážovice, Pohansko";PCA;-;PCA;PCA;Features:  5 PCs (200-1000 nm);PCA, LDA;LDA;LDA;LDA (5 PCs);-;accuracy: 86%;External;R Studio
https://pubs.rsc.org/en/content/articlelanding/2015/ja/c4ja00352g#!divAbstract;Classification of iron ores by laser-induced breakdown spectroscopy (LIBS) combined with random forest (RF);Sheng et al., 2014;Northwest University ;Institute of Analytical Science, College of Chemistry & Materials Science, Northwest University,China;China;Journal of Analytical Atomic Spectrometry;59;02.12.2014;2014;Geological samples;Iron Ores;10;H140115-014, H140122-036,H140121-041,H140115-042,H140123-065-PT,H140122-073-PT, H140123-080-PT, H140119-092, H140123-097-PT, H140118-080;Visual inspection;-;-;-;LIBS spectrum:  RawInt (200-940 nm);RF, SVM;RF;RF;RF (72 trees);accuracy: 100%;-;Internal;MATLAB
https://pubs.rsc.org/en/content/articlelanding/2015/ja/c4ja00421c#!divAbstract;Quantitative and classification analysis of slag samples by laser induced breakdown spectroscopy (LIBS) coupled with support vector machine (SVM) and partial least square (PLS) methods;Zhang et al., 2014;Northwest University ;Institute of Analytical Science, School of Chemistry & Material Science, Northwest University, China;China;Journal of Analytical Atomic Spectrometry;80;09.12.2014;2014;Materials;Slag;2;open-hearth furnace slag (GSBH42011-94), high titanium slag (YS/T 298-2007));Visual inspection;-;-;?;Features:  28 RawInt (220-800 nm);PLS-DA;PLS-DA;PLS-DA;PLS-DA;accuracy: 100%;-;Internal;MATLAB
https://iopscience.iop.org/article/10.1088/1009-0630/17/8/08/meta;Rock and soil classification using PLS-DA and SVM combined with a laser-induced breakdown spectroscopy Library;Yang et al., 2015;Jilin University;College of Instrumentation and Electrical Engineering, Jilin University, China;China;Plasma Science and Technology;34;21.04.2015;2015;Geological samples;Soil;13;"andesite (GBW07104(GSR-2)), basalt (GBW07105(GSR3)), shale (GBW07107(GSR-5)), argillaceous limestone (GBW07108(GSR-6)), carbonate (GBW07135)
and mudstone (GBW(E)070040); soil:
chestnut soil (GBW07402(GSS-2)), yellow brown earth
(GBW07403(GSS-3)), limestone soil (GBW07404(GSS4)), yellow red soil (GBW07406(GSS-6)), latosol
(GBW07407(GSS-7)), loess (GBW07408(GSS-8)), 
Sichuan Basin soil (GBW07428(GSS-14))";?;-;-;-;LIBS spectrum:  38007 RawInt (200-600 nm);PLS-DA, SVM;SVM;SVM;SVM;accuracy: 97%;-;Internal;?
https://www.sciencedirect.com/science/article/abs/pii/S0584854715001846?via%3Dihub;Increased identification rate of scrap metal using Laser Induced Breakdown Spectroscopy Echelle spectra;Merk et al., 2015;LTB;LTB Lasertechnik Berlin GmbH, Germany;Germany;Spectrochimica Acta Part B: Atomic Spectroscopy;29;28.07.2015;2015;Materials;Scrap metal;10;Ag alloy, Al alloy, Cr alloy, Cu alloy, Fe alloy, Ni alloy, Pb alloy, Sn alloy, Zn alloy, brass;?;Smooth, NormSNV;-;-;LIBS spectrum:  RawInt (242-548 nm);PCA, PLS-DA;PLS-DA;PLS-DA;PLS-DA (9 LVs);-;accuracy: 88%;External;?
https://pubs.rsc.org/en/content/articlelanding/2015/ay/c5ay02208h#!divAbstract;Classification of different types of slag samples by laser-induced breakdown spectroscopy (LIBS) coupled with random forest based on variable importance (VIRF);Tang et al., 2015;Northwest University ;Institute of Analytical Science, School of Chemistry & Material Science, Northwest University, China;China;Analytical Methods;19;21.09.2015;2015;Materials;Slag;3;open-hearth furnace slag, converter slag, high titanium slag;Visual inspection;NormArea;VIRF;Embedded (RF);LIBS spectrum:  RawInt (200-500 nm);PLS-DA, SVM, RF, VI-RF;RF;RF;RF;accuracy: 99%;-;Internal;MATLAB
https://iopscience.iop.org/article/10.1088/1009-0630/17/11/06/pdf;Classification and Discrimination of Minerals Using Laser Induced Breakdown Spectroscopy and Raman Spectroscopy;Bi et al., 2015;Shandong University;School of Mechanicals, Electrical & Information Engineering, Shandong University, China;China;Plasma Science and Technology;10;01.11.2015;2015;Geological samples;Minerals;6;gypsum, spodumene, barite, haematite, moonstone, labradorite;Visual inspection;Norm;algorithmic peak extraction;Algorithmic peak extraction;LIBS-Raman:  3265 PeakInt (200-915 nm) + Raman (150-4500cm-1);PLS-DA, ANN, SVM;ANN;ANN, SVM;ANN, SVM;accuracy: 100%;-;Internal;MATLAB
https://iopscience.iop.org/article/10.1088/1009-0630/17/11/14/meta;Selection of spectral data for classification of steels using laser-induced breakdown spectroscopy;Kong et al., 2015;Chinese Academy of Sciences;Shenyang Institute of Automation, Chinese Academy of Sciences, China;China;Plasma Science and Technology;15;01.11.2015;2015;Materials;Steel;4;carbon steels, low alloy steels, high alloy steels, stainless steel;Visual inspection + PCA;-;wrapper (PCA-ANN);Wrapper-based;LIBS subregion:  1474 RawInt (357-367 nm);PCA, ANN;ANN;PCA-ANN;ANN;accuracy: 100%;-;Internal;MATLAB
https://www.sciencedirect.com/science/article/abs/pii/S0584854716300106;Multivariate classification of edible salts: Simultaneous Laser-Induced Breakdown Spectroscopy and Laser-Ablation Inductively Coupled Plasma Mass Spectrometry Analysis;Lee et al., 2016;Mokpo National University;Department of Chemistry, Mokpo National University, Republic of Korea;South Korea;Spectrochimica Acta Part B: Atomic Spectroscopy;31;01.04.2016;2016;Foodstuff;Salts;10;"Laizhou, Okinawa, Hokkaido, Kochi, Jeung-Do, Haenam, Younggwang, Guerande, Brazil, Chile (sea salts); Mongolia, Poland, India, Pakistan (rock salts) ";PCA;NormIS (Na: 330.2, 819.5 nm);domain knowledge;Domain k-wledge;"LIBS subregion: RawInt (362-410 nm; 765-771 nm)";PCA, PLS-DA;PLS-DA;PLS-DA;PLS-DA ;accuracy: 87.2%;-;Internal;Unscrambler
https://www.sciencedirect.com/science/article/abs/pii/S0143816615002596;Study of archaeological coins of different dynasties using libs coupled with multivariate analysis;Awasthi et al., 2016;University of Allahabad;Department of Physics, University of Allahabad, India;India;Optics and Lasers in Engineering;35;01.04.2016;2016;Materials;Coins;5;Coin of Western Kshatrapa Rulers Rudrasimha, Coin of Indo- Parthian and Northen Kshstrapa Rulers, Coin of Maghas, Coin of Pusavasri, Coin of Gonapatroga  ;PCA;-;-;?;-;-;?;?;-;-;-;?;Unscrambler
https://pubs.rsc.org/en/content/articlelanding/2016/ay/c6ay01138a#!divAbstract;Direct chemical inspection of eye shadow and lipstick solid samples using laser-induced breakdown spectroscopy (LIBS) and chemometrics: proposition of classification models;Augusto et al., 2016;Federal University of São Carlos;Chemistry Department, Federal University of São Carlos, Brazil;Brazil;Analytical Methods;14;29.06.2016;2016;Materials;Eye shadow;2;contaminated ( > 5 mg kg-1), non-contaminated  ( > 5 mg kg-1);PCA;-;PCA-based;PCA;LIBS subregion:  4853 RawInt (186-580 nm);PCA, SIMCA, PLS-DA, KNN;KNN;KNN;KNN (3 neighbors);accuracy: 98%;-;Internal;?
https://pubs.rsc.org/en/content/articlelanding/2016/ja/c6ja00224b#!divAbstract;Twelve different types of data normalization for the proposition of classification, univariate and multivariate regression models for the direct analyses of alloys by laser-induced breakdown spectroscopy (LIBS);Castro et al., 2016;Federal University of São Carlos;Chemistry Department, Federal University of São Carlos, Brazil;Brazil;Journal of Analytical Atomic Spectrometry;106;06.07.2016;2016;Materials;Alloys;3;steel (71-99% (w/w)), steel (16-67% (w/w)), alloys (<6 % (w/w));?;Norm (12 modes compared);?;?;?;KNN, SIMCA, PLS-DA;KNN;KNN;KNN (1 neighbor);accuracy: 100%;-;?;MATLAB
https://link.springer.com/article/10.1007/s40995-016-0084-x;Identification and Sorting of PVC Polymer in Recycling Process by Laser-Induced Breakdown Spectroscopy (LIBS) Combined with Support Vector Machine (SVM) Model;Dastjerdi et al., 2016;University of Isfahan;Department of Physics, University of Isfahan, Iran;Iran;Iranian Journal of Science and Technology, Transactions A: Science;16;31.08.2016;2016;Polymers;Polymers;5;polyethylene (PE), polypropylene (PP), polyvinyl chloride (PVC), polystyrene (PS), poly(methyl metacrylate) (PMMA);?;?;?;?;?;SVM;SVM;SVM;SVM (polynomial kernel, 2nd degree);accuracy: 90.5%;-;?;MATLAB
